{
  "thoughtProcess": "Based on the deployment error and evidence, the primary hypothesis is a configuration or permission issue. The deployment method and error patterns suggest systematic validation of template parameters and service principal permissions is needed.",
  "newHypotheses": [
    {
      "id": "h1",
      "description": "Deployment template has invalid parameter values or syntax errors"
    },
    {
      "id": "h2", 
      "description": "Service principal lacks required permissions on target resource group"
    },
    {
      "id": "h3",
      "description": "Resource provider not registered in subscription"
    }
  ],
  "newQuestions": [],
  "recommendedState": "Execute"
}
